musica,letras
Iron Maiden,"Won't you come into my roomI wanna show you all my waresI just want to see your bloodI just want to stand and stare See the blood begin to flow As it falls upon the floor Iron  Maiden can't be fought Iron  Maiden can't be sought Oh well, wherever Wherever you are Iron  Maiden's gonna get you No matter how far See the blood flow watching it shed Up above my head Iron  Maiden wants you for dead Won't you come into my roomI wanna show you all my waresI just want to see your bloodI just want to stand and stare See the blood begin to flow As it falls upon the floor Iron  Maiden can't be faught Iron  Maiden can't be sought Oh well, wherever Wherever you are Iron  Maiden's gonna get you No matter how far See the blood flow watching it shed Up above my head Iron  Maiden wants you for dead Won't you come into my roomI wanna show you all my waresI just want to see your bloodI just want to stand and stare See the blood begin to flow As it falls upon the floor Iron  Maiden can't be fought Iron  Maiden can't be sought Oh well, wherever Wherever you are Iron  Maiden's gonna get you No matter how far See the blood flow watching it shed Up above my head Iron  Maiden wants you for dead"
The Number Of The Beast,"Woe to you, oh, earth and sea For the devil sends the beast with wrath Because he knows the time is short Let him who hath understanding reckon The number of the beast for it is a human number Its number is six hundred and sixty six I left alone, my mind was blankI needed time to think to Get the memories from my mind What did I see, can I believe That what I saw that night was real And not just fantasy Just what I saw, in my old dreams Were they reflections of my warped mind Staring back at me ' Cause in my dreams, it's always there The evil face that twists my mind and brings Me to despair The night was black, was no use holding back' Cause I just had to see, was someone watching me In the mist, dark figures move and twist Was all this for real, or just some kind of hell666, the number of the beast Hell and fire was spawned to be released Torches blazed and sacred chants were praised As they start to cry Hands held to the sky In the night, the fires are burning bright The ritual has begun, satan's work is done666, the number of the beast Sacrifice is going on tonight This can't go on, I must inform the law Can this still be real or just some crazy dream But I feel drawn towards the chanting hordes They seem to mesmerize Can't avoid their eyes666, the number of the beast666, the one for you and me I'm coming back, I will return And I'll possess your body and I'll make you burnI have the fire, I have the forceI have the power to make my evil take it's course"
Hallowed Be Thy Name,"I'm waiting in my cold cell, when the bell begins to chime Reflecting on my past life and it doesn't have much time' Cause at 5 o'clock they take me to the gallows pole The sands of time for me are running low When the priest comes to read me the last ritesI take a look through the bars at the last sights Of a world that has gone very wrong for me Can it be that there's some sort of error Hard to stop the surmounting terror Is it really the end, not some crazy dream? Somebody please tell me that I'm dreaming It's not so easy to stop from screaming But words escape me when I try to speak Tears flow but why am I crying After all I'm not afraid of dying Don't I believe that there never is an end As the guards march me out to the courtyard Somebody cries from a cell:  God be with you If there's a god then why has he let me go? As I walk all my life drifts before me Though the end is near I'm still not sorry Catch my soul, it's willing to fly away Mark my words please believe my soul lives on Please don't worry now that I have goneI've gone beyond to see the truth When you know that your time is close at hand Maybe then you'll begin to understand Life down here is just a strange illusion Hallowed be thy name"
Sanctuary,"Out of winter came a warhorse of steelI've never killed a woman before but I know how it feelsI know you'd have gone insane if you saw what I saw So now I've got to look for sanctuary from the law I met up with a stranger last night To keep me alive He spends all his time on gambling and guns to surviveI know you'd have gone insane if you saw what I saw So now I've got to look for sanctuary from the law So give me sanctuary from the law And I'll be alright Just give me sanctuary from the law And love me tonight, tonight I know you'd have gone insane if you saw what I saw So now I've got to look for sanctuary from the law So give me sanctuary from the law And I'll be alright Just give me sanctuary from the law And love me tonight, tonight I can laugh at the windI can howl at the rain Down in the canyon or out on the plain I know you'd have gone insane if you saw what I saw So now I've got to look for sanctuary from the law So give me sanctuary from the law And I'll be alright Just give me sanctuary from the law And love me tonight, tonight"
Run To The Hills,"White man came across the sea He brought us pain and misery He killed our tribes, he killed our creed He took our game for his own need We fought him hard, we fought him well Out on the plains, we gave him hell But many came, too much for  Cree Oh, will we ever be set free? Riding through dustclouds and barren wastes Galloping hard on the plains Chasing the redskins back to their holes Fighting them at their own game Murder for freedom, a stab in the back Women and children and cowards attack Run to the hills, run for your lives Run to the hills, run for your lives Soldier blue in the barren wastes Hunting and killing for game Raping the women and wasting the men The only good  Indians are tame Selling them whisky and taking their gold Enslaving the young and destroying the old Run to the hills, run for your lives Run to the hills, run for your lives Run to the hills, run for your lives Run to the hills, run for your lives Run to the hills, run for your lives Run to the hills, run for your lives"
Prowler,"Walking through the city, looking oh so prettyI've just got to find my way See the ladies flashing All there legs and lashesI've just got to find my way Well you see me crawling through the bushes With it open wide What you seeing girl? Can't you believe that feeling, can't you believe it Can't you believe your eyes? It's the real thing girl Got me feeling myself and reeling around Got me talking but feel like walking around Got me feeling myself and reeling a Got me talking but nothing's with me Got me feeling myself and reeling around"
Remember Tomorrow,"Unchain the colours before my eyes Yesterday's sorrows, tomorrow's white lies Scan the horizon, the clouds take me higherI shall return from out of the fire Tears for remembrance, and tears for joy Tears for somebody and this lonely boy Out in the madness, the all seeing eye Flickers above us, to light up the sky Unchain the colours before my eyes Yesterday's sorrows, tomorrow's white lies Scan the horizon, the clouds take me higherI shall return from out of the fire"
Phantom Of The Opera,"I've been looking so long for you now you won't get away from my grasp You've been living so long in hiding in hiding behind that false mask And you know and I know that you aint got long now to last Your looks and your feelings are just the remains of your past You're standing in the wings, there you wait for the curtain to fall Knowing the terror and holding you have on us all Yeah, I know that you're gonna scratch me, maim me and maul You know I'm helpless from your mesmerising cat call Keep your distance, walk away, don't take his bait Don't you stray, don't fade away Watch your step, he's out to get you, come what may Don't you stray, from the narrow way I'm running and hiding in my dreams you're always there You're the phantom of the opera, you're the devil, you're just out to scare You damaged my mind and my soul it just floats through the air Haunt me, you taunt me, you torture me back at your lair"
Iron Maiden,"Won't you come into my roomI wanna show you all my waresI just want to see your bloodI just want to stand and stare See the blood begin to flow As it falls upon the floor Iron  Maiden can't be fought Iron  Maiden can't be sought Oh well, wherever Wherever you are Iron  Maiden's gonna get you No matter how far See the blood flow watching it shed Up above my head Iron  Maiden wants you for dead Won't you come into my roomI wanna show you all my waresI just want to see your bloodI just want to stand and stare See the blood begin to flow As it falls upon the floor Iron  Maiden can't be faught Iron  Maiden can't be sought Oh well, wherever Wherever you are Iron  Maiden's gonna get you No matter how far See the blood flow watching it shed Up above my head Iron  Maiden wants you for dead Won't you come into my roomI wanna show you all my waresI just want to see your bloodI just want to stand and stare See the blood begin to flow As it falls upon the floor Iron  Maiden can't be fought Iron  Maiden can't be sought Oh well, wherever Wherever you are Iron  Maiden's gonna get you No matter how far See the blood flow watching it shed Up above my head Iron  Maiden wants you for dead"
Wrathchild,"I was born into a scene Of angriness and greed Of dominance and persecution. My mother was a queen My dad I've never seenI was never meant to be. Now I spend my time Looking all around For a man that's nowhere To be found, Until I find him,I'm never gonna stop searchingI'm going to find my man Gonna travel round. Cos I'm a wrathchild, Well I'm a wrathchild, Yeh I'm a wrathchild. I'm coming to get you Oh, yeah yeah. Some say it shouldn't matter Ain't nothing gonna alter The course of my destination. But I know I've gotta find Some seriaus peace of mind Or I know I'll just go crazy. Now I spend my time Looking all around For a man that's nowhere To be found, Until I find him,I'm never gonna stop searchingI'm going to find my man Gonna travel round. Cos I'm a wrathchild, Well I'm a wrathchild, Yeh I'm a wrathchild. I'm coming to get you Oh, yeah yeah."
Murders In The Rue Morgue,I remember it as plain as day Although it happened in the dark of the nightI was strolling throught the streets of  Paris And it was cold it was starting to rain And then I heard a piercing scream And I rushed to the scene of the crime But all I found was butchered remains Of two girls laying side by side Murders in the  Rue  Morgue Someone call the  Gendarmes Murders in the  Rue  Morgue Flee before the killers go free There's some people coming down the street At last someone's heard my callI can't understand why they're pointing at meI never done nothing at all Well I must have got some blood on my hands Because everybody's shouting at meI can't speak  French so I couldn't explain And like a fool I started running away Murders in the  Rue  Morgue Someone call the  Gendarmes Murder in the  Rue  Morgue Am I ever going to be free And now I've gotta get away from the arms of the law All  France is looking for meI've gotta find my way across the border for sure Down the  South to  Italy Murders in the  Rue  Morgue Running from the  Gendarme Murders in the  Rue  MorgueI'm never going home Well I made it to the border at last But I can't erase the scene from my mind Any time somebody stares at me Well I just started running blind Well I'm running throught the shadows tonight Away from the staring eyes Any day they'll be looking for me Cause I know that I show the signs of... Murders in the  Rue  Morgue Running from the  Gendarmes Murders in the  Rue  Morgue Runnin' from the arms of the law Murders in the  Rue  Morgue Running from the  Gendarmes Murders in the  Rue  Morgue Am I ever gonna be free It took so long and I'm getting so tiredI'm running out of places to hide Should I return to the scene of the crime Where the two young victims died If I could go to somebody to help It would get me out of trouble for sure But I know that it's on my mind That my doctor said I've done it before Murders in the  Rue  Morgue They're never gonna find me Murders in the  Rue  MorgueI'm never going home
Genghis Khan,instrumental
Killers,"You walk through the subway, His eyes burn a hole in your back.A footstep behind you, He lunges prepared for attack Scream for mercy, He laughs as he's watching you bleed. Killer behind you, His blood lust defies all his needs My innocent victims Are slaughtered with wrath and despise, The mocking religion of hatred That burns in the nightI have no-one,I'm bound to destroy All this greed.A voice inside me, Compelling to satisfy me I can see, What a knife's meant to be. You'll never know, How I came to foresee. My faith in believing is stronger Than lifelines and ties, With the glimmer of metal My moment is ready to strike. The death call arises,A scream breaks the still of the night. Another tomorrow Remember to walk in the light. I have found you, And now there is no place to run. Excitement shakes me, Oh  God help me what have I done. Yeah I've done it again! He walks through the subway My eyes burn a hole through your back.A footstep behind you He lunges prepared for attack. Scream for mercy, He laughs as he's watching you bleed. Killer behind you, My blood lust defies all my needs Look out I'm coming for you!"
Drifter,"Look out now baby won't you take me away, Sitting here I think it's gonna be a new day. Gonna get my song 'til I can't go on, Gonna keep on roaming gotta sing my song. What you feeling when you hold me tight, Gonna cuddle up to you tonight. Gonna get you feeling so secure. Listen child, don't you see there's a cure. Anywhere got to get you away, Feels so good, think it's gonna be a new day. Gonna get my song 'til I cant go on, Gonna keep on roaming gotta sing my song. What you feeling when you hold me tight,I wanna cuddle up to you tonight. Gonna get you feeling so secure. Listen child, don't you see there's a cure. Anywhere got to get you away, Feels so good, think it's gonna be a new day. Gonna get my song 'til I cant go on, Gonna keep on roaming gotta sing my song. Gonna sing my song yeah, And it won't take long. Gonna sing my song yeah, Won't you sing along.I wan't you to sing it,sing it, sing it, sing it along. Repeat."
Invaders,"Longboats have been sighted, the evidence of war has begun Many  Nordic fighting men, their swords and shields all gleam in the sun Call to arms defend yourselves, get ready to stand and fight for your lives Judgement day has come around, so be prepared don't run stand your ground They're coming in from the sea They've come the enemy Beneath the blazing sun The battle has to be won Invaders pillaging Invaders looting Set ablaze the camp fires, alert the other men from inland Warning must be given, there's not enough men here for a stand The  Vikings are too many, much too powerful to take on our own We must have reinforcements, we cannot fight this battle alone They're coming over the hill They've come to attack They're coming in for the kill There's no turning back Invaders fighting Invaders marauding Axes grind and maces clash, as wounded fighters fall to the ground Severed limbs and fatal woundings, bloody corpses lay all around The smell of death and burning flesh, the battle weary fight to the end The  Saxons have been overpowered, victims of the mighty  Norsemen You'd better scatter and run The battle's lost and not won You'd better get away To fight another day Invaders raping Invaders plundering"
Children Of The Damned,"He's walking like a small child But watch his eyes burn you away Black holes in his golden stare God knows he wants to go home Children of  The  Damned Children of  The  Damned Children of  The  Damned Children of  The  Damned He's walking like a dead man If he had lived he would have crucified us all Now he's standing on his last step He thought oblivion, well it beckons to us all Children of  The  Damned Children of  The  Damned Children of  The  Damned Children of  The  Damned Now it's burning his hands, he's turning to laugh Smiles as the flames sear his flesh Melting his face, screaming in pain Peeling the skin from his eyes Watch him die according to plan He's dust on the ground, what did we learn You're  Children of  The  Damned Your back's against the wall You turn into the light You're burning in the night You're  Children of  The  Damned Like candles watch them burn Burning in the light You'll burn again tonight You're  Children of  The  Damned"
The Prisoner,"We want information, information, information Who are you? The new number two. Who´s number one? You are number six.I´m not a number ya.I´m a free man! Hahahahaha! I'm on the run, I'll kill to eat, Starving now, feeling dead on my feet. Going all the way, I'm nature's beast. Do what i want, I do as i please. Run, you've gotta fight, to breathe, it's tough. Now you see me, now you don't. Break the walls, I'm coming out. I'm not a prisoner, I'm a free man, And my blood is my own now. Don't care where the past was,I know where I'm going...out. If you kill me, it's self defence. If I kill you, then I call it vengeance. Spit in your eye, I will defy. You'll be afraid when I call out your name. Run, you've gotta fight, to breathe, it's tough. Now you see me, now you don't. Break the walls, I'm coming out. I'm not a prisoner, I'm a free man, And my blood is my own now. Don't care where the past was,I know where I'm going. I'm not a number, I'm a free man,I'll live my life how i want to. You'd better scratch mefrom your black book,' Cause I'll run rings around you."
22 Acacia Avenue,"If you're feeling down depressed and lonelyI know a place where we can go22 acacia avenue meet a lady that I know So if you're looking for a good time And you're prepared to pay the price Fifteen quid is all she asks for Everybody's got their vice If you're waiting for a long time for the rest to do their piece You can tell her that you know me and you might even get it free So any time you're down the east end don't you hesitate to go You can take my honest word for it she'll teach you more than you can know Charlotte can't you get out from all this madness Can't you see it only brings you sadness When you entertain your men don't know the risk of getting disease Some day when you're reaching the age of fortyI bet you'll regret the days when you were laying Nobody then will want to know You won't have any beautiful wares to show any more 22, the avenue that's the place where we all go You will find it's warm inside the red lights burning bright tonight Charlotte isn't it time you stopped this mad life Don't you ever think about the bad times Why do you have to live this way Do you enjoy your lay or is it the pay Sometimes when your strolling down the avenue The way you walk it make men think of having you When you're walking down the street Everybody stops and turns to stare at you 22, the avenue that's the place where we all go You will find it's warm inside the red lights burning bright tonight Beat her mistreat her do anything that you please Bite her excite her make her get down on her knees Abuse her misuse her she can take all that you've got Caress her molest her she always does what you want You're running away don't you know what you're doing Can't you see it'll lead you to ruin Charlotte you've taken your life and you've thrown it away You believe that because what you're earning Your life's good don't you know that you're hurting All the people that love you don't cast them aside All the men that are constantly drooling It's no life for you stop all that screwing You're packing your bags and you're coming with me"
The Number Of The Beast,"Woe to you, oh, earth and sea For the devil sends the beast with wrath Because he knows the time is short Let him who hath understanding reckon The number of the beast for it is a human number Its number is six hundred and sixty six I left alone, my mind was blankI needed time to think to Get the memories from my mind What did I see, can I believe That what I saw that night was real And not just fantasy Just what I saw, in my old dreams Were they reflections of my warped mind Staring back at me ' Cause in my dreams, it's always there The evil face that twists my mind and brings Me to despair The night was black, was no use holding back' Cause I just had to see, was someone watching me In the mist, dark figures move and twist Was all this for real, or just some kind of hell666, the number of the beast Hell and fire was spawned to be released Torches blazed and sacred chants were praised As they start to cry Hands held to the sky In the night, the fires are burning bright The ritual has begun, satan's work is done666, the number of the beast Sacrifice is going on tonight This can't go on, I must inform the law Can this still be real or just some crazy dream But I feel drawn towards the chanting hordes They seem to mesmerize Can't avoid their eyes666, the number of the beast666, the one for you and me I'm coming back, I will return And I'll possess your body and I'll make you burnI have the fire, I have the forceI have the power to make my evil take it's course"
Run To The Hills,"White man came across the sea He brought us pain and misery He killed our tribes, he killed our creed He took our game for his own need We fought him hard, we fought him well Out on the plains, we gave him hell But many came, too much for  Cree Oh, will we ever be set free? Riding through dustclouds and barren wastes Galloping hard on the plains Chasing the redskins back to their holes Fighting them at their own game Murder for freedom, a stab in the back Women and children and cowards attack Run to the hills, run for your lives Run to the hills, run for your lives Soldier blue in the barren wastes Hunting and killing for game Raping the women and wasting the men The only good  Indians are tame Selling them whisky and taking their gold Enslaving the young and destroying the old Run to the hills, run for your lives Run to the hills, run for your lives Run to the hills, run for your lives Run to the hills, run for your lives Run to the hills, run for your lives Run to the hills, run for your lives"
Hallowed Be Thy Name,"I'm waiting in my cold cell, when the bell begins to chime Reflecting on my past life and it doesn't have much time' Cause at 5 o'clock they take me to the gallows pole The sands of time for me are running low When the priest comes to read me the last ritesI take a look through the bars at the last sights Of a world that has gone very wrong for me Can it be that there's some sort of error Hard to stop the surmounting terror Is it really the end, not some crazy dream? Somebody please tell me that I'm dreaming It's not so easy to stop from screaming But words escape me when I try to speak Tears flow but why am I crying After all I'm not afraid of dying Don't I believe that there never is an end As the guards march me out to the courtyard Somebody cries from a cell:  God be with you If there's a god then why has he let me go? As I walk all my life drifts before me Though the end is near I'm still not sorry Catch my soul, it's willing to fly away Mark my words please believe my soul lives on Please don't worry now that I have goneI've gone beyond to see the truth When you know that your time is close at hand Maybe then you'll begin to understand Life down here is just a strange illusion Hallowed be thy name"
Where Eagles Dare,"It's snowing outside, the rumbling sound Of engines roar in the night The mission is near, the confident men Are waiting to drop from the sky The  Blizzard goes on, but still they must fly No one should go where eagles dare Bavarian  Alps that lay all around They seem to stare from below The enemy lines a long time passed Are lying deep in the snow Into the night they fall through the sky No one should fly where eagles dare Their closing in, the fortress is near It's standing high in the sky The cable car's the only way in It's really impossible to climb They make their way, but maybe too late They've got to try to save the day The panicking cries, the roaring of guns Are echoing all around the valley The mission complete, they make to escape Away from the  Eagles  Nest They dared to go where no one would try They chose to fly where eagles dare"
Revelations,"""O  God of  Earth and  Altar, Bow down and hear our cry, Our earthly rulers falter, Our people drift and die, The walls of gold entomb us, The swords of scorn divide, Take not thy thunder from us, But take away our pride."" Just a babe in a black abyss, No reason for a place like this. The walls are cold and souls cry out in pain. An easy way for the blind to go,A clever path for the fools who know. The  Secret of the  Hangman ­ the smile on his lips. The light of the  Blind ­ you'll see, The venom that tears my spine, The  Eyes of the  Nile are opening ­ you'll see. She came to me with a serpents kiss, As the  Eye of the  Sun rose on her lips. Moonlight catches silver tears I cry. So we lay in a black embrace, And the  Seed is sown in a holy place, And I watched and I waited for the  Dawn. The light of the  Blind ­ you'll see, The venom that tears my spine, The  Eyes of the  Nile are opening ­ you'll see. S O LO Bind us all together, Ablaze with  Hope and  Free. No storm or heavy weather, Will rock the boat you'll see. The time has come to close your eyes, And still the wind and rain. For the one who will be  King, Is the watcher in the  Ring. It is  You."
