musica,letras
If Eternity Should Fail,"Here is the soul of a man Here, in this place, for the taking Clothed in white, stand in the light Here is the soul of a man Time to speak with the shaman again Conjure the jester again Black dog in the ruins is howling my name So, here is the soul of a man When the world was virgin Before the coming of men Just a solar witness The beginning of the end From a world of magma To a cold rock face The ascent of madness And a human race We are strange believers, all of us There are stranger truths, immortal lust We rise from slumber, he calls our name Recalls our number, abide with pain Reef in a sail at the edge of the world If eternity should fail Waiting in line for the ending of time If eternity should fail Reef in a sail at the edge of the world If eternity should fail Waiting in line for the ending of time If eternity should fail To god’s illusion which I recall Was our delusion Before the fall The angels come and the angels go But the lord of light shining below Eternal blackness beyond the stars We think our wisdom will get that far At the master’s table, the table’s bare No land of plenty, devastation, despair Reef in a sail at the edge of the world If eternity should fail Waiting in line for the ending of time If eternity should fail Reef in a sail at the edge of the world If eternity should fail Waiting in line at the ending of time If eternity should fail Reef in a sail at the edge of the world If eternity should fail Waiting in line for the ending of time If eternity should fail Reef in a sail at the edge of the world If eternity should fail Waiting in line at the ending of time If eternity should fail Reef in a sail at the edge of the world If eternity should fail Waiting in line at the ending of time If eternity should fail Reef in a sail at the edge of the world If eternity should fail Waiting in line at the ending of time If eternity should fail Good day my name is  NecropolisI am formed of the deadI am the harvester of the soul meat And I suck the lives from around my bed My own two sons, I gave them breath And I filled their living corpses with my bile What humanity I knew, I have long forgotten For me, eternity is nothing But a short while"
Speed Of Light,"Another time, another placeA hollow universe in spaceI took a trip to see the sightsI will be blacker than the night One way ticket, no return My shootin' star so fast it burns On the edge that you can't see Let's shoot the moon, you and meI'm not particular, you see Just a lonesome galaxy Shadows in the stars We will not return Humanity won't save us At the speed of light Shadows in the stars We will not return Humanity won't save us We slip into the night I'll say a mass for you and wave Shootin' plasma from my grave Event horizon lost in space Runnin' in a human raceI don't know where, I don't know when But somehow, back there time againI'm on the edge that you can't seeI’m not particular at nightA single particle of me You won’t be tracking me by sight Shadows in the stars We will not return Humanity won't save us At the speed of light Shadows in the stars We will not return Humanity won't save us We slip into the night Shadows in the stars We will not return Humanity won't save us At the speed of light Shadows in the stars We will not return Humanity won't save us We slip into the night Shadows in the stars We will not return Humanity won't save us At the speed of light Shadows in the stars We will not return Humanity won't save us We're slipping into the night Shadows in the stars We will not return Humanity won't save us At the speed of light Shadows in the stars We will not return Humanity won't save us We slip into the night"
The Great Unknown,Winter softly falling to the ground Calmly waiting don’t you hear a sound When the world has fallen to the depths below Where the future’s open and the fear has grown And the path to follow to the great unknown Where the dark has fallen and the seed is sown In the selfish hearts of some The nightmare’s coming With the spilling blood of others Now wringing through Now the cup is spilling over Wake to news of death And the prophecy of sages Destiny is met To the depths of human mind The cry is burning With the mentor’s anger Of the lesson ringing true And for those who live by and are dying by the sword They will take their ideals with them Justify their end Where the fools are lying and the meek are crying Where the wolves are preying On the weak alone Where the sons are dying Hear their mothers crying And the distant sound of fire Begins again Never ending the desires of men It’ll never be the same or calm again In a time of changing hearts And great unknown It’ll be the damnation and end of us all Where the fools are lying And the meek are crying Where the wolves are preying On the weak alone Where the sons are dying Hear their mothers crying And the distant sound of fire begins again Never ending the desires of men It’ll never be the same or calm again In a time of changing hearts And great unknown It’ll be the damnation and end of us all When the world has fallen And we stand alone
The Red And The Black,The morals of life and the perils of death Take the wrong way out running out of breath Meet my match in the afterlife Suppress the demons that plague the nightA tortured mind is a safe place to go But the truth lurks down in the dark below Step inside my inquisitive mind Are you scared at what you just might find See myself in the hall of mirrorsA different shape every step I takeA different mind every step of the line But in the end they are all mine Laughing sorrow inside your head Can’t get out just a feeling of dreadI know this burden's a heavy loadA dark mistake never ending road The black jack king and the red queen clash The artful dodger he counts his stash The joker’s wild like an impish child While madame fortune she waits inside The good luck charm is overkill The tired old soldier says fire at will Planes overhead go search destroy The ones below human decoy I need somebody to save me Meanwhile we play the waiting game The clock is struck the horse is lame And when we think that this is done Chance your luck a four leafed one You hedge your bets the battle lost To wait in vain and count the cost The thin edged line Between good and bad And cast the luck be happy sad I need somebody to save me The red and the black People don’t want the truth Look in their eyes and you send them away The red and the black Fate and hypocrisy Burden’s a heavy load there is no doubt The red and the black All out of luck again How many chances can anyone have? The red and the black Treachery out to win There in the wrong place and at the wrong time I need somebody to save me
When The River Runs Deep,Look for something that is hard to find Searching somewhere deep inside your mind Hope you find just what you’re looking for Heaven’s waiting with an open door If you should sell your soul as cheaply as I did then The road to ruin is a long road to hide in We signed our lives away to have an escape It’s something that will be whatever our fate There’s no use in hiding Got to keep on trying Can’t take no more lying This is the last There’s no time for crying When some of us are dying None of us decide what is our fate Now with nothing to hide going nowhere Take my chances and stand by their sides When the river runs deep And the line breaks And the blood it flows Free from our lives Is this the last together maybe this time now We stand together and we’re holding the line here There’s nothing we can do just sit here and wait The die is cast that is deciding our fate There’s no use in hiding Got to keep on trying Can’t take no more lying This is the last There’s no time for crying When some of us are dying None of us decide What is our fate Now with nothing to hide going nowhere Take my chances and stand by their sides When the river runs deep And the line breaks And the blood it flows Free from our lives Now with nothing to hide going nowhere Take my chances and stand by their sides When the river runs deep And the line breaks And the blood it flows Free from our lives Now with nothing to hide going nowhere Take my chances and stand by their sides When the river runs deep And the line breaks And the blood it flows Free from our lives Now with nothing to hide going nowhere Take my chances and stand by their sides When the river runs deep And the line breaks And the blood it flows Free from our lives
The Book Of Souls,"Sacrifices buried with kings Accompany them on a journey with no end To an afterlife that’s rich, with fruit of all the gods And to face the demons Of their underworld haunts The sentient is sent to seek out all the truthA flight to earth that is a given from his birth To rise from ashes of the dead Out of the fire is sent to fulfil man’s desire By power day and night and death he ruled them The sky and earth and the fires too Two headed reptile symbol of his reign Universes of the underworldA life that’s full of all the wealth and riches Can never last for an eternity After living in a golden paradise The ultimate sacrifice Prophecy of sky gods, the sun and moon Passing of old ways will come true soon Falling of ages, forest of kings The search for the truth, the book of souls The rulers of planets and stars The power of the kings of traders and the wars Planetary cycles and the phases of the moon Is in the document, a kingdom they will learn They were praying to the gods of nature And were living in the cities of stone Towers reaching upward to the heavens Sacred wonders for the world unknown Make their lives be a mystery no more Records kept and the passing of laws Sacred gods to the book of lies When a civilization dies Prophecy of sky gods, the sun and moon Passing of old ways will come true soon Falling of ages, forest of kings The lost book of souls, destruction begins Ascending the throne wearing feathers and shells He brought back their lives from the void Alien invasion brings nothing, but death Mass exodus and plant life destroyed Domain of the  Earth to the journey of truth The underworld caves, mayan slaves Defeat of the dark lords The ultimate proof In the place where the ancestors rule The book of souls"
Death Or Glory,"I see the enemy, I know he can’t see me Combat red in tooth and claw Ready now for one more score Took a bullet in my brain Inside, I’m the king of pain Outside, you will fear my nameI ride a blood red triplane Turn like the devil, shoot straight from the sun Climb like a monkey out of hell where I belong Death or glory, it’s all the same Death or glory, the price of fame Death or glory, I’m in the game of Death or glory, a one way train I watch you spiral down Dead before you hit the ground Bullet got you in the back Deflection shooting beam attackI shoot the gunner firstI kill to quench my thirstI hunt the weakest prey Live to fly another day Turn like the devil, shoot straight from the sun Climb like a monkey out of hell where I belong Death or glory, it’s all the same Death or glory, the price of fame Death or glory, I’m in the game of Death or glory, a one way train Turn like the devil, shoot straight from the sun Climb like a monkey out of hell where I belong Death or glory, it’s all the same Death or glory, the price of fame Death or glory, I’m in the game of Death or glory, a one way train Death or glory, it’s all the same Death or glory, the price of fame Death or glory, I’m in the game of Death or glory, a one way train"
Shadows Of The Valley,"Wandering aimlessly in a cold dark mist I follow Walking in a dark world that’s been Kissed with sadness Without sunlight, things are born To the dead of nightmares Soulless demons laughing in a sea of madness Listen closely to the raven’s call Praying hard for our world not to end Try as might to make sense of it all Will it be for the penance of men Follow north for the call of the wild Look all out for a small wayward child Lay in fear as the dark raven crows Look for guidance from the one who knows He lived on this earth for a time and a half Playing a tune to the old man’s laugh The fear that’s inside the men of the oath In the script of the book that he wrote Ask them the questions Tell them no liesA cry for freedom Praying that they wouldn’t die Mind over matter Cry over sins Their lives are over now Ended before they begin As the raven again passes byI can hear all the wake fathers cry That the first born of all men will die That their lives will be taken from them Face the danger, a battle of wills Strength and courage, a cure for all ills We believe in that thou shall not kill But others are ready to spill The hearts of all men since beginning of time Living with temptation Wanting and crimeA walk in the shadow of the valley of death Knowing I’ll take my last breath Ask them the questions Tell them no liesA cry for freedom Praying that they wouldn’t die Mind over matter Cry over sins Their lives are over now Ended before they begin The hearts of all men since beginning of time Living with temptation Wanting and crimeA walk in the shadow of the valley of death Knowing I’ll take my last breath Ask them the questions Tell them no liesA cry for freedom Praying that they wouldn’t die Mind over matter Cry over sins Their lives are over now Ended before they begin Into the valley of death fear no evil We will go forward no matter the cost Into the valley of death, follow me now Bring me your souls and I’ll make it our last Ask them the questions Tell them no liesA cry for freedom Praying that they wouldn’t die Mind over matter Cry over sins Their lives are over now Ended before they begin"
Tears of a Clown,"All alone in a crowded room He tries to force a smile The smile it beamed or so it seemed But never reached the eyes, disguise Masquerading as the funny man do they despise The false smile, maketh of the man Glass empty or half full Try to make some sense or sorrows drown All looks well on the outside Underneath, the solemn truth There’s something that inside has died Tomorrow comes, tomorrow goes But the cloud remains the same Wonder why he’s feeling down Tears of a clown Maybe it’s all just for the best Lay his weary head to rest Was forever feeling drowned Tears of a clown Who motivates the motivator? Facade it has to go He knows, it sooner or later Smile for cameras, all okay But tomorrow is another day, he must get through He had a longer way to run Or so the story goes Life full of fun, where did it go? We saw the sadness in his eyes It came as no surprise And now, of course, we’ll never know Tomorrow comes, tomorrow goes But the cloud remains the same Wonder why he’s feeling down Tears of a clown Maybe it’s all just for the best Lay his weary head to rest Was forever feeling drowned Tears of a clown Tomorrow comes tomorrow goes But the cloud remains the same Wonder why he’s feeling down Tears of a clown Maybe it’s all just for the best Lay his weary head to rest Was forever feeling down Tears of a clown, tears of a clown Tears of a clown, tears of a clown"
The Man Of Sorrows,"Like a man without a home Watching people come and go Carry on their daily lives Without a thought for the ones alone Cast the dream aside like throwingA pebble into the ocean tide And I’m feeling so alone again Free the angry from their pain Free the captives from the chains Cast aside the doubt that Nothing good can come their way again Living in a world of lies No matter how or hard we try Living life without a dream today Looking through a mist of truth That we believe an elusive cloud The things we find are hard to say now That we live through day to day Find it hard to force the reasons Why we find it hard to die Now, we need to know the truth now Open our eyes that we can see So we live and breathe again Better days for you and me Can we even hope to deliver this? We are so far away As one turns against the other With a brother against brother Situation like no other it’s a picture of despair As we look to see the man of sorrows Passing knowledge to those who don’t know As we watch all our friends passing over As they pass through the edges of time And we see what’s ahead that awaits us That no longer do we feel afraid So we look to see the man of sorrows And the light is the darkness, no more As we look to see the man of sorrows Passing knowledge to those who don’t know As we watch all our friends passing over As they pass through the edges of time And we see what’s ahead that awaits us That no longer do we feel afraid So we look to see the man of sorrows And the light is the darkness, no more"
Empire Of The Clouds,"To ride the storm to an empire of the clouds To ride the storm they climbed Aboard their silver ghost To ride the storm to a kingdom that will come To ride the storm and damn the rest Oblivion Royalty and dignitaries,  Brandy and cigars Grey lady giant of the skies You hold them in your arms The millionth chance, they laughed To take down his  Majesty’s craft"" To  India"", they say, "" Magic carpet float away"" An  October fateful day Mist is in the trees Stone sweats with the dew The morning sunrise, red before the blue Hanging at the mast, waiting for command His  Majesty’s airship, the R101 She’s the biggest vessel built by manA giant of the skies For all you unbelievers, the  Titanic fits inside Drum roll, tight her canvas skin, silvered in the sun Never tested with the fury, with the beating yet to come The fury yet to come In the gathering gloom The storm rising in the west The coxswain stared Into the plunging weather glass We must go now We must take our chance with fate We must go now For a politician, he can’t be late The airship crew awake for thirty hours at full stretch But the ship is in their backbone Every sinew, every inch She never flew at full speed, a trial never done Her fragile outer cover her  Achilles would become An  Achilles yet to come Sailors of the sky, a hardened breed Loyal to the king and an airship creed The engines drum, the telegraph sounds Release the cords that bind us to the ground Said the coxswain:“ Sir, she’s heavy, she’ll never make this flight“ Said the captain:“ Damn the cargo, we’ll be on our way tonight“ Groundlings cheered in wonder As she backed off from the mast Baptizing them her water from the ballast fore and aft Now, she slips into our past Fighting the wind as it rolls you Feeling the diesels that push you along Watching the channel below you Lower and lower into the night Lights are passing below you Northern  France asleep in their beds Storm is raging around you""A million to one"", that’s what he said Reaper standing beside her With his scythe, cuts to the bone Panic to make a decision Experienced men asleep in their graves Her cover is ripped and she’s drowning Rain is flooding into the hull Bleeding to death and she’s falling Lifting gas is draining away “ We’re down lads“, came the cry Bow plunging from the sky Three thousand horses silent as the ship began to die The flares to guide her path, ignited at the last The empire of the clouds Just ashes in our past, just ashes at the last Here lie their dreams as I stand in the sun On the ground where they built and the engines did run To the moon and the stars Now, what have we done? Oh, the dreamers may die, but the dreams live on Dreams live on, dreams live on Now a shadow on a hill The angel of the east The empire of the clouds May rest in peace And in a country churchyard Laid head to the mast Eight and forty souls Who came to die in  France"
Satellite 15... The Final Frontier,"I try to call the  Earth's command Desperation in my voiceI'm drifting way off course now With very little choice The loneliness is hard to bearI try to calm my fear Just hoping any second now Some contact filters through Desperate calls... Signal back from  Satellite As my life flashes right infront of me Try again...must get through Hear me now... For I've very little time Not much time...hear my call Please get through...I am here I'm stranded in space, I'm lost without traceI haven't this chance of getting away Too close to the sun and surely will burn Like  Icarus before me or so legend goes I think my life, reliving my past There's nothing but wait til' my time comesI've had a good life, I'd do it again Maybe I'll come back some time afresh For I have lived my life to the full, I have no regrets But I wish I could talk to my family to tell them one last goodbye The final frontier, the final frontier!! The final frontier, the final frontier!! If I could survive to live one more time, I wouldn't be changing a thing at all Done more in my life than some do in ten - I'd go back and do it all over again For I have lived my life to the full, I have no regrets But I wish I could talk to my family and tell them that one last goodbye The final frontier, the final frontier!! The final frontier, the final frontier!! Solo ( Smith/ Murray) There isn't much time, must say my last rites -  Nobody is here to read them to me Must say my goodbyes, if only a line - A message to tell them in case they might find... For I have lived my life to the full, I have no regrets But I wish I could talk to my family to tell them that one last goodbye The final frontier, the final frontier!! The final frontier, the final frontier!! The final frontier, the final frontier!! The final frontier, the final frontier!! Ah, ah!  The final frontier, the final frontier!! The final frontier, the final frontier!!"
El Dorado,"Gotta to tell you a story On a cold winter's night You'll be sailing for glory Before you know what is right So come over here nowI got a vision for you It's my personal snake oil It's just something I doI'm the jester with no tears And I'm playing on your fearsI'm a trickster smiling underneath this mask of love and death The eternal lie I've told About the pyramids of goldI've got you hooked at every turn, your money's left to burn Ha ha ha ha ha ha ha! You'll be wanting a contract You'll be waiting a whileI'd like to give you my contact But that isn't my style Well you only get one chance And it's too good to miss If I didn't lie to you Then I wouldn't exist Greed lust and envy pride It's same old same old ride The smoke and mirrors visions that you see Are just like meI'm a clever banker's face With just a letter out of placeI know someone just like you know someone just like me El  Dorado, come and play El  Dorado, step this way Take a ticket for the ride El  Dorado streets of gold See my ship is oversold You've got one last chance to try So gone is the glory And gone is the gold Well if you knew a storyhow come it has to be told Well you can say I'm a devil And I wouldn't say no But out here on the dark side Hey, on with the show So now my tale is told Big and bad and twice as bold This ship of fools is sinking as the cracks begin to grow There is no easy way For an honest man today Which is something you should think on As my life boat sails away El  Dorado, come and play El  Dorado, step this way Take a ticket for the ride El  Dorado, of streets of gold See my ship is oversold You've got one last chance to try El  Dorado, come and play El  Dorado, step this way Take a ticket for the ride El  Dorado of streets of gold See my ship is oversold You've got one last chance to try"
Mother Of Mercy,"Sitting waiting in the falling rain Getting ready to begin again Wounded lying crying Bodies moving dying All around there is the smell Of death and fire Here the planes are coming Hear the soldiers running Killing on a scale to comprehend Why are we here In this place...here to kill Please  God forgive us For what we have done I always thought I was doing right As of now I'm not feeling so sure I'm at a place of whereI give no graceI'm a soldier of war I sit waiting for my darkest hour to comeI cannot think about the things that I have done It shouldn't take a fool to see that I believe Accept the consequence, repent for what I've done You tell me what is certain But I'll tell you what is true You tell me what is honesty When all around is death and cruelty The making of a man is fire Not giving into our desires Within the truth that lies Within the only thing Mother of mercy Angel of death desire Mother of mercy Taking my last breath of fire Mother of mercy Angel of pain Mother of mercy Taking my last breath Some say you are a lost cause Some say you're a saint Just being here's an act Of suffering and restraint Walk down the long dark road To ruin and panic notI'll die a lonely death Of that I'm certain of Rivers flow with blood There's nowhere left to hide It's hard to comprehend There's anyone left alive Sick of all the killing And the reek of death Will  God tell me What religion is to man I don't hold with bad religion Understand what's underneath it Now I come to think of itI just don't hold at all you know it You say you are a holy man But what is it you do From where I stand is nothing But a hollow man I see Mother of mercy Angel of death desire Mother of mercy Taking my last breath of fire Mother of mercy Angel of pain Mother of mercy Taking my last breath Mother of mercy Angel of death desire Mother of mercy Taking my last breath, of fire Mother of mercy Angel of pain Mother of mercy Drawing my last breath I'm just a lonely soldier fighting In a bloody hopeless war Don't know what I'm fighting Who it is or what I'm fighting for Thought it was for money Make my fortune, now I'm not so sure Seem to just have lost my way"
